codepoint,character,name
2700,✀,BLACK SAFETY SCISSORS
2701,✁,UPPER BLADE SCISSORS
2702,✂,BLACK SCISSORS
2703,✃,LOWER BLADE SCISSORS
2704,✄,WHITE SCISSORS
2705,✅,WHITE HEAVY CHECK MARK
2706,✆,TELEPHONE LOCATION SIGN
2707,✇,TAPE DRIVE
2708,✈,AIRPLANE
2709,✉,ENVELOPE
270A,✊,RAISED FIST
270B,✋,RAISED HAND
270C,✌,VICTORY HAND
270D,✍,WRITING HAND
270E,✎,LOWER RIGHT PENCIL
270F,✏,PENCIL
2710,✐,UPPER RIGHT PENCIL
2711,✑,WHITE NIB
2712,✒,BLACK NIB
2713,✓,CHECK MARK
2714,✔,HEAVY CHECK MARK
2715,✕,MULTIPLICATION X
2716,✖,HEAVY MULTIPLICATION X
2717,✗,BALLOT X
2718,✘,HEAVY BALLOT X
2719,✙,OUTLINED GREEK CROSS
271A,✚,HEAVY GREEK CROSS
271B,✛,OPEN CENTRE CROSS
271C,✜,HEAVY OPEN CENTRE CROSS
271D,✝,LATIN CROSS
271E,✞,SHADOWED WHITE LATIN CROSS
271F,✟,OUTLINED LATIN CROSS
2720,✠,MALTESE CROSS
2721,✡,STAR OF DAVID
2722,✢,FOUR TEARDROP-SPOKED ASTERISK
2723,✣,FOUR BALLOON-SPOKED ASTERISK
2724,✤,HEAVY FOUR BALLOON-SPOKED ASTERISK
2725,✥,FOUR CLUB-SPOKED ASTERISK
2726,✦,BLACK FOUR POINTED STAR
2727,✧,WHITE FOUR POINTED STAR
2728,✨,SPARKLES
2729,✩,STRESS OUTLINED WHITE STAR
272A,✪,CIRCLED WHITE STAR
272B,✫,OPEN CENTRE BLACK STAR
272C,✬,BLACK CENTRE WHITE STAR
272D,✭,OUTLINED BLACK STAR
272E,✮,HEAVY OUTLINED BLACK STAR
272F,✯,PINWHEEL STAR
2730,✰,SHADOWED WHITE STAR
2731,✱,HEAVY ASTERISK
2732,✲,OPEN CENTRE ASTERISK
2733,✳,EIGHT SPOKED ASTERISK
2734,✴,EIGHT POINTED BLACK STAR
2735,✵,EIGHT POINTED PINWHEEL STAR
2736,✶,SIX POINTED BLACK STAR
2737,✷,EIGHT POINTED RECTILINEAR BLACK STAR
2738,✸,HEAVY EIGHT POINTED RECTILINEAR BLACK STAR
2739,✹,TWELVE POINTED BLACK STAR
273A,✺,SIXTEEN POINTED ASTERISK
273B,✻,TEARDROP-SPOKED ASTERISK
273C,✼,OPEN CENTRE TEARDROP-SPOKED ASTERISK
273D,✽,HEAVY TEARDROP-SPOKED ASTERISK
273E,✾,SIX PETALLED BLACK AND WHITE FLORETTE
273F,✿,BLACK FLORETTE
2740,❀,WHITE FLORETTE
2741,❁,EIGHT PETALLED OUTLINED BLACK FLORETTE
2742,❂,CIRCLED OPEN CENTRE EIGHT POINTED STAR
2743,❃,HEAVY TEARDROP-SPOKED PINWHEEL ASTERISK
2744,❄,SNOWFLAKE
2745,❅,TIGHT TRIFOLIATE SNOWFLAKE
2746,❆,HEAVY CHEVRON SNOWFLAKE
2747,❇,SPARKLE
2748,❈,HEAVY SPARKLE
2749,❉,BALLOON-SPOKED ASTERISK
274A,❊,EIGHT TEARDROP-SPOKED PROPELLER ASTERISK
274B,❋,HEAVY EIGHT TEARDROP-SPOKED PROPELLER ASTERISK
274C,❌,CROSS MARK
274D,❍,SHADOWED WHITE CIRCLE
274E,❎,NEGATIVE SQUARED CROSS MARK
274F,❏,LOWER RIGHT DROP-SHADOWED WHITE SQUARE
2750,❐,UPPER RIGHT DROP-SHADOWED WHITE SQUARE
2751,❑,LOWER RIGHT SHADOWED WHITE SQUARE
2752,❒,UPPER RIGHT SHADOWED WHITE SQUARE
2753,❓,BLACK QUESTION MARK ORNAMENT
2754,❔,WHITE QUESTION MARK ORNAMENT
2755,❕,WHITE EXCLAMATION MARK ORNAMENT
2756,❖,BLACK DIAMOND MINUS WHITE X
2757,❗,HEAVY EXCLAMATION MARK SYMBOL
2758,❘,LIGHT VERTICAL BAR
2759,❙,MEDIUM VERTICAL BAR
275A,❚,HEAVY VERTICAL BAR
275B,❛,HEAVY SINGLE TURNED COMMA QUOTATION MARK ORNAMENT
275C,❜,HEAVY SINGLE COMMA QUOTATION MARK ORNAMENT
275D,❝,HEAVY DOUBLE TURNED COMMA QUOTATION MARK ORNAMENT
275E,❞,HEAVY DOUBLE COMMA QUOTATION MARK ORNAMENT
275F,❟,HEAVY LOW SINGLE COMMA QUOTATION MARK ORNAMENT
2760,❠,HEAVY LOW DOUBLE COMMA QUOTATION MARK ORNAMENT
2761,❡,CURVED STEM PARAGRAPH SIGN ORNAMENT
2762,❢,HEAVY EXCLAMATION MARK ORNAMENT
2763,❣,HEAVY HEART EXCLAMATION MARK ORNAMENT
2764,❤,HEAVY BLACK HEART
2765,❥,ROTATED HEAVY BLACK HEART BULLET
2766,❦,FLORAL HEART
2767,❧,ROTATED FLORAL HEART BULLET
2768,❨,MEDIUM LEFT PARENTHESIS ORNAMENT
2769,❩,MEDIUM RIGHT PARENTHESIS ORNAMENT
276A,❪,MEDIUM FLATTENED LEFT PARENTHESIS ORNAMENT
276B,❫,MEDIUM FLATTENED RIGHT PARENTHESIS ORNAMENT
276C,❬,MEDIUM LEFT-POINTING ANGLE BRACKET ORNAMENT
276D,❭,MEDIUM RIGHT-POINTING ANGLE BRACKET ORNAMENT
276E,❮,HEAVY LEFT-POINTING ANGLE QUOTATION MARK ORNAMENT
276F,❯,HEAVY RIGHT-POINTING ANGLE QUOTATION MARK ORNAMENT
2770,❰,HEAVY LEFT-POINTING ANGLE BRACKET ORNAMENT
2771,❱,HEAVY RIGHT-POINTING ANGLE BRACKET ORNAMENT
2772,❲,LIGHT LEFT TORTOISE SHELL BRACKET ORNAMENT
2773,❳,LIGHT RIGHT TORTOISE SHELL BRACKET ORNAMENT
2774,❴,MEDIUM LEFT CURLY BRACKET ORNAMENT
2775,❵,MEDIUM RIGHT CURLY BRACKET ORNAMENT
2776,❶,DINGBAT NEGATIVE CIRCLED DIGIT ONE
2777,❷,DINGBAT NEGATIVE CIRCLED DIGIT TWO
2778,❸,DINGBAT NEGATIVE CIRCLED DIGIT THREE
2779,❹,DINGBAT NEGATIVE CIRCLED DIGIT FOUR
277A,❺,DINGBAT NEGATIVE CIRCLED DIGIT FIVE
277B,❻,DINGBAT NEGATIVE CIRCLED DIGIT SIX
277C,❼,DINGBAT NEGATIVE CIRCLED DIGIT SEVEN
277D,❽,DINGBAT NEGATIVE CIRCLED DIGIT EIGHT
277E,❾,DINGBAT NEGATIVE CIRCLED DIGIT NINE
277F,❿,DINGBAT NEGATIVE CIRCLED NUMBER TEN
2780,➀,DINGBAT CIRCLED SANS-SERIF DIGIT ONE
2781,➁,DINGBAT CIRCLED SANS-SERIF DIGIT TWO
2782,➂,DINGBAT CIRCLED SANS-SERIF DIGIT THREE
2783,➃,DINGBAT CIRCLED SANS-SERIF DIGIT FOUR
2784,➄,DINGBAT CIRCLED SANS-SERIF DIGIT FIVE
2785,➅,DINGBAT CIRCLED SANS-SERIF DIGIT SIX
2786,➆,DINGBAT CIRCLED SANS-SERIF DIGIT SEVEN
2787,➇,DINGBAT CIRCLED SANS-SERIF DIGIT EIGHT
2788,➈,DINGBAT CIRCLED SANS-SERIF DIGIT NINE
2789,➉,DINGBAT CIRCLED SANS-SERIF NUMBER TEN
278A,➊,DINGBAT NEGATIVE CIRCLED SANS-SERIF DIGIT ONE
278B,➋,DINGBAT NEGATIVE CIRCLED SANS-SERIF DIGIT TWO
278C,➌,DINGBAT NEGATIVE CIRCLED SANS-SERIF DIGIT THREE
278D,➍,DINGBAT NEGATIVE CIRCLED SANS-SERIF DIGIT FOUR
278E,➎,DINGBAT NEGATIVE CIRCLED SANS-SERIF DIGIT FIVE
278F,➏,DINGBAT NEGATIVE CIRCLED SANS-SERIF DIGIT SIX
2790,➐,DINGBAT NEGATIVE CIRCLED SANS-SERIF DIGIT SEVEN
2791,➑,DINGBAT NEGATIVE CIRCLED SANS-SERIF DIGIT EIGHT
2792,➒,DINGBAT NEGATIVE CIRCLED SANS-SERIF DIGIT NINE
2793,➓,DINGBAT NEGATIVE CIRCLED SANS-SERIF NUMBER TEN
2794,➔,HEAVY WIDE-HEADED RIGHTWARDS ARROW
2795,➕,HEAVY PLUS SIGN
2796,➖,HEAVY MINUS SIGN
2797,➗,HEAVY DIVISION SIGN
2798,➘,HEAVY SOUTH EAST ARROW
2799,➙,HEAVY RIGHTWARDS ARROW
279A,➚,HEAVY NORTH EAST ARROW
279B,➛,DRAFTING POINT RIGHTWARDS ARROW
279C,➜,HEAVY ROUND-TIPPED RIGHTWARDS ARROW
279D,➝,TRIANGLE-HEADED RIGHTWARDS ARROW
279E,➞,HEAVY TRIANGLE-HEADED RIGHTWARDS ARROW
279F,➟,DASHED TRIANGLE-HEADED RIGHTWARDS ARROW
27A0,➠,HEAVY DASHED TRIANGLE-HEADED RIGHTWARDS ARROW
27A1,➡,BLACK RIGHTWARDS ARROW
27A2,➢,THREE-D TOP-LIGHTED RIGHTWARDS ARROWHEAD
27A3,➣,THREE-D BOTTOM-LIGHTED RIGHTWARDS ARROWHEAD
27A4,➤,BLACK RIGHTWARDS ARROWHEAD
27A5,➥,HEAVY BLACK CURVED DOWNWARDS AND RIGHTWARDS ARROW
27A6,➦,HEAVY BLACK CURVED UPWARDS AND RIGHTWARDS ARROW
27A7,➧,SQUAT BLACK RIGHTWARDS ARROW
27A8,➨,HEAVY CONCAVE-POINTED BLACK RIGHTWARDS ARROW
27A9,➩,RIGHT-SHADED WHITE RIGHTWARDS ARROW
27AA,➪,LEFT-SHADED WHITE RIGHTWARDS ARROW
27AB,➫,BACK-TILTED SHADOWED WHITE RIGHTWARDS ARROW
27AC,➬,FRONT-TILTED SHADOWED WHITE RIGHTWARDS ARROW
27AD,➭,HEAVY LOWER RIGHT-SHADOWED WHITE RIGHTWARDS ARROW
27AE,➮,HEAVY UPPER RIGHT-SHADOWED WHITE RIGHTWARDS ARROW
27AF,➯,NOTCHED LOWER RIGHT-SHADOWED WHITE RIGHTWARDS ARROW
27B0,➰,CURLY LOOP
27B1,➱,NOTCHED UPPER RIGHT-SHADOWED WHITE RIGHTWARDS ARROW
27B2,➲,CIRCLED HEAVY WHITE RIGHTWARDS ARROW
27B3,➳,WHITE-FEATHERED RIGHTWARDS ARROW
27B4,➴,BLACK-FEATHERED SOUTH EAST ARROW
27B5,➵,BLACK-FEATHERED RIGHTWARDS ARROW
27B6,➶,BLACK-FEATHERED NORTH EAST ARROW
27B7,➷,HEAVY BLACK-FEATHERED SOUTH EAST ARROW
27B8,➸,HEAVY BLACK-FEATHERED RIGHTWARDS ARROW
27B9,➹,HEAVY BLACK-FEATHERED NORTH EAST ARROW
27BA,➺,TEARDROP-BARBED RIGHTWARDS ARROW
27BB,➻,HEAVY TEARDROP-SHANKED RIGHTWARDS ARROW
27BC,➼,WEDGE-TAILED RIGHTWARDS ARROW
27BD,➽,HEAVY WEDGE-TAILED RIGHTWARDS ARROW
27BE,➾,OPEN-OUTLINED RIGHTWARDS ARROW
27BF,➿,DOUBLE CURLY LOOP
1F650,🙐,NORTH WEST POINTING LEAF
1F651,🙑,SOUTH WEST POINTING LEAF
1F652,🙒,NORTH EAST POINTING LEAF
1F653,🙓,SOUTH EAST POINTING LEAF
1F654,🙔,TURNED NORTH WEST POINTING LEAF
1F655,🙕,TURNED SOUTH WEST POINTING LEAF
1F656,🙖,TURNED NORTH EAST POINTING LEAF
1F657,🙗,TURNED SOUTH EAST POINTING LEAF
1F658,🙘,NORTH WEST POINTING VINE LEAF
1F659,🙙,SOUTH WEST POINTING VINE LEAF
1F65A,🙚,NORTH EAST POINTING VINE LEAF
1F65B,🙛,SOUTH EAST POINTING VINE LEAF
1F65C,🙜,HEAVY NORTH WEST POINTING VINE LEAF
1F65D,🙝,HEAVY SOUTH WEST POINTING VINE LEAF
1F65E,🙞,HEAVY NORTH EAST POINTING VINE LEAF
1F65F,🙟,HEAVY SOUTH EAST POINTING VINE LEAF
1F660,🙠,NORTH WEST POINTING BUD
1F661,🙡,SOUTH WEST POINTING BUD
1F662,🙢,NORTH EAST POINTING BUD
1F663,🙣,SOUTH EAST POINTING BUD
1F664,🙤,HEAVY NORTH WEST POINTING BUD
1F665,🙥,HEAVY SOUTH WEST POINTING BUD
1F666,🙦,HEAVY NORTH EAST POINTING BUD
1F667,🙧,HEAVY SOUTH EAST POINTING BUD
1F668,🙨,HOLLOW QUILT SQUARE ORNAMENT
1F669,🙩,HOLLOW QUILT SQUARE ORNAMENT IN BLACK SQUARE
1F66A,🙪,SOLID QUILT SQUARE ORNAMENT
1F66B,🙫,SOLID QUILT SQUARE ORNAMENT IN BLACK SQUARE
1F66C,🙬,LEFTWARDS ROCKET
1F66D,🙭,UPWARDS ROCKET
1F66E,🙮,RIGHTWARDS ROCKET
1F66F,🙯,DOWNWARDS ROCKET
1F670,🙰,SCRIPT LIGATURE ET ORNAMENT
1F671,🙱,HEAVY SCRIPT LIGATURE ET ORNAMENT
1F672,🙲,LIGATURE OPEN ET ORNAMENT
1F673,🙳,HEAVY LIGATURE OPEN ET ORNAMENT
1F674,🙴,HEAVY AMPERSAND ORNAMENT
1F675,🙵,SWASH AMPERSAND ORNAMENT
1F676,🙶,SANS-SERIF HEAVY DOUBLE TURNED COMMA QUOTATION MARK ORNAMENT
1F677,🙷,SANS-SERIF HEAVY DOUBLE COMMA QUOTATION MARK ORNAMENT
1F678,🙸,SANS-SERIF HEAVY LOW DOUBLE COMMA QUOTATION MARK ORNAMENT
1F679,🙹,HEAVY INTERROBANG ORNAMENT
1F67A,🙺,SANS-SERIF INTERROBANG ORNAMENT
1F67B,🙻,HEAVY SANS-SERIF INTERROBANG ORNAMENT
1F67C,🙼,VERY HEAVY SOLIDUS
1F67D,🙽,VERY HEAVY REVERSE SOLIDUS
1F67E,🙾,CHECKER BOARD
1F67F,🙿,REVERSE CHECKER BOARD
